{
  "schema_version": "0.2",
  "evidence_id": "EVID_ODR_001",
  "subject": {"kind": "organization_design_relationship", "id": "ODR_TEST_001"},
  "field_pointer": "/role",
  "source_id": "SRC_TEST_003",
  "source_locator": {"page": null, "section": null, "anchor": null, "table": null, "figure": null, "record_key": null},
  "observation": {
    "raw": {"kind": "literal", "value": "builder", "unit": null, "excerpt": null}
  },
  "evidence_type": "manufacturer_specification",
  "producer": {"kind": "human", "identifier": "researcher-01", "version": null, "model": null, "prompt_or_rule_version": null},
  "research_context": {"research_job_id": null, "activity_id": null},
  "observed_at": "2026-08-18T12:30:00Z",
  "confidence": "high",
  "supersedes_evidence_id": null,
  "notes": "OrganizationDesignRelationship addressed by stable relationship ID"
}
