{
  "schema_version": "0.2",
  "evidence_id": "EVID_BRAND_001",
  "subject": {"kind": "brand", "id": "BR_TEST_001"},
  "field_pointer": "/canonical_name",
  "source_id": "SRC_TEST_001",
  "source_locator": {"page": null, "section": null, "anchor": null, "table": null, "figure": null, "record_key": "wikidata:Q12345"},
  "observation": {
    "raw": {"kind": "literal", "value": "Alpha Yachts", "unit": null, "excerpt": null},
    "normalized_candidate": null
  },
  "evidence_type": "structured_dataset",
  "producer": {"kind": "deterministic_tool", "identifier": "hullq-importer", "version": "0.1", "model": null, "prompt_or_rule_version": null},
  "research_context": {"research_job_id": null, "activity_id": null},
  "observed_at": "2026-08-18T10:00:00Z",
  "confidence": "high",
  "supersedes_evidence_id": null,
  "notes": "Brand canonical name from Wikidata CC0"
}
